{
    "$schema": "http://json-schema.org/draft-07/schema#",
    "title": "Starter Metadata",
    "description": "Metadata schema for fhevm starter templates",
    "type": "object",
    "required": [
        "id",
        "name",
        "description",
        "difficulty",
        "tags"
    ],
    "properties": {
        "id": {
            "type": "string",
            "description": "Unique identifier for the starter",
            "pattern": "^[a-z0-9-]+$"
        },
        "name": {
            "type": "string",
            "description": "Display name of the starter",
            "minLength": 1
        },
        "description": {
            "type": "string",
            "description": "Brief description of what this starter demonstrates",
            "minLength": 10
        },
        "difficulty": {
            "type": "string",
            "description": "Difficulty level",
            "enum": [
                "beginner",
                "intermediate",
                "advanced"
            ]
        },
        "tags": {
            "type": "array",
            "description": "Tags for categorization",
            "items": {
                "type": "string"
            },
            "minItems": 1,
            "uniqueItems": true
        },
        "fheOperations": {
            "type": "array",
            "description": "FHE operations demonstrated",
            "items": {
                "type": "string"
            },
            "uniqueItems": true
        },
        "author": {
            "type": "object",
            "properties": {
                "name": {
                    "type": "string"
                },
                "url": {
                    "type": "string",
                    "format": "uri"
                }
            },
            "required": [
                "name"
            ]
        },
        "version": {
            "type": "string",
            "pattern": "^\\d+\\.\\d+\\.\\d+$"
        }
    },
    "additionalProperties": false
}
